{
  "id": "hero.home",
  "kind": "section",
  "category": "hero",
  "source": {
    "id": "dom:Hero:hero",
    "tag": "<section id=\"hero\" className=\"hero\">",
    "file": "src/components/Hero.jsx",
    "lines": "4-80"
  },
  "semantic": {
    "id": "hero.home",
    "category": "hero"
  },
  "purpose": "The home hero: a two-tone h1, a copyright stamp, a scroll cue, a two-row label marquee, a local-only upload dropzone and an 8-photograph rotating ring.",
  "content": {
    "type": "object",
    "additionalProperties": false,
    "properties": {
      "heading": {
        "type": "string",
        "maxWords": 3,
        "note": "Measured: 2 words, \"Your catalog,\"."
      },
      "headingAccent": {
        "type": "string",
        "maxWords": 3,
        "note": "Measured: 2 words, \"instantly re-shot.\", in a .u-fonts-50 span inside the same h1. The two-tone h1 is the site's signature heading treatment."
      },
      "copyrightYear": {
        "type": "string",
        "maxWords": 2,
        "note": "Measured: the literal \"2026\", injected at runtime by public/motion/m03.js from [data-current-year]."
      },
      "scrollCue": {
        "type": "string",
        "maxWords": 3,
        "note": "Measured: 2 words, \"scroll down\"."
      },
      "scrollCueHref": {
        "type": "string",
        "format": "route-or-inert-hash"
      },
      "sliderItems": {
        "type": "array",
        "minItems": 6,
        "maxItems": 6,
        "items": {
          "type": "string",
          "maxWords": 3
        },
        "note": "Exactly 6, measured 1-2 words each: PDPs, UGC, Lifestyle shots, Ads, Stories, Street style. Duplicated into a second identical row to make the marquee seamless."
      },
      "uploadPrompt": {
        "type": "string",
        "maxWords": 6,
        "note": "Measured: 5 words, \"Upload or drop your assets\"."
      },
      "carouselImages": {
        "type": "array",
        "minItems": 8,
        "maxItems": 8,
        "items": {
          "type": "object",
          "additionalProperties": false,
          "properties": {
            "assetRole": {
              "type": "string",
              "enum": [
                "hero-carousel-photo",
                "fictional-person-avatar",
                "generated-illustration",
                "user-supplied-asset"
              ]
            },
            "assetRef": {
              "type": "string",
              "format": "local-asset-path"
            },
            "alt": {
              "type": "string",
              "maxWords": 28,
              "note": "Required on every content image. Measured 3-27 words across the real images (longest: a 27-word hero carousel description); the four decorative preloader images ship alt=\"\", which is why the empty string is allowed. alt is accessibility text, not visible page copy, so it carries its own budget but is excluded from contentMaxWordsTotal.",
              "allowEmpty": true,
              "countsTowardTotal": false
            }
          },
          "required": [
            "assetRole"
          ]
        },
        "note": "Exactly 8, one per 45-degree position class."
      }
    },
    "required": [
      "heading",
      "headingAccent",
      "scrollCue",
      "scrollCueHref",
      "sliderItems",
      "uploadPrompt",
      "carouselImages"
    ]
  },
  "contentMaxWordsTotal": 28,
  "usedOn": [
    "/"
  ],
  "evidence": {
    "structure": "Structure, layout and motion measured against the live original. A pixel audit verified 1382/1382 elements at a 1440px viewport and 962/962 at 390px with zero deltas. Copy is the original's own.",
    "copy": "a-exact"
  },
  "bodyCopyFields": [],
  "variants": {},
  "constraints": {
    "onePerPage": true,
    "maxPerPage": 1,
    "mustBeFirstInBody": true,
    "homeRouteOnly": true,
    "verification": "src/pages/Home.jsx:12 renders <Hero /> as the first child of <Layout>. Checked against all 5 real templates: it appears only in `home`, at the first body position immediately after chrome.menu."
  },
  "media": {
    "carousel": {
      "assetRole": [
        "hero-carousel-photo"
      ],
      "policy": "must-not-fabricate",
      "count": 8,
      "generatedAssetRoles": [
        "fictional-person-avatar",
        "generated-illustration",
        "user-supplied-asset"
      ]
    }
  },
  "motion": {
    "pattern": "hero-reveal",
    "detail": "public/motion/m25.js reveals every [data-hero-text] element with a 0.2 stagger and honours a data-final-opacity attribute, so some words deliberately settle at 0.5 rather than 1. The .hero__slider__row CSS marquee runs 24s linear infinite. m17.js rotates .hero__carousel__in 360 degrees over 32s (ease none, repeat -1) and m18.js counter-rotates each image so the photographs stay upright. m16.js binds the dropzone.",
    "reducedMotionFallback": "Show the h1, the copyright stamp and the scroll cue at their final opacity with no stagger; freeze the label marquee and the photograph ring at their initial frames; keep the dropzone fully interactive.",
    "reducedMotionFallbackKind": "design-rule (the source ships NO prefers-reduced-motion handling for this section, so the fallback is prescribed by this repository, not mirrored)"
  },
  "responsive": {
    "structured": true,
    "breakpoint": "992px (min-width)",
    "base": "the label marquee scrolls VERTICALLY (--ty-end: -100%)",
    "max-991px": "the label marquee FLIPS to HORIZONTAL (--tx-end: -100%) and heading.page drops 5.5rem -> 4.5rem",
    "max-767px": "heading.page drops to 2.5rem; the marquee stays horizontal"
  },
  "tokens": [
    "heading.page",
    "text.primary",
    "text.muted",
    "caption.xsmall",
    "label.secondary",
    "surface.page-fade",
    "elevation.z-raised",
    "elevation.z-overlay",
    "elevation.z-dropzone",
    "motion.marquee.duration",
    "motion.carousel.rotation",
    "layout.hero.slider-axis",
    "radius.panel"
  ],
  "composes": [
    "component.marquee-row",
    "component.carousel-ring",
    "component.upload-dropzone",
    "component.media-image"
  ],
  "measuredFrom": [
    {
      "id": "cit-sec-hero-root",
      "source": "src/components/Hero.jsx:4-4",
      "quote": "<section id=\"hero\" className=\"hero\">"
    },
    {
      "id": "cit-sec-hero-h1",
      "source": "src/components/Hero.jsx:7-9",
      "quote": "hero__title u-h1 u-fonts-100"
    },
    {
      "id": "cit-sec-hero-accent",
      "source": "src/components/Hero.jsx:8-9",
      "quote": "<span className=\"u-fonts-50\">"
    },
    {
      "id": "cit-sec-hero-year",
      "source": "src/components/Hero.jsx:10-13",
      "quote": "data-current-year"
    },
    {
      "id": "cit-sec-hero-scroll",
      "source": "src/components/Hero.jsx:15-16",
      "quote": "hero__scroll u-small-text-2 u-fonts-100"
    },
    {
      "id": "cit-sec-hero-slider",
      "source": "src/components/Hero.jsx:19-31",
      "quote": "hero__slider__row"
    },
    {
      "id": "cit-sec-hero-upload",
      "source": "src/components/Hero.jsx:50-52",
      "quote": "Upload or drop your assets"
    },
    {
      "id": "cit-sec-hero-carousel",
      "source": "src/components/Hero.jsx:57-59",
      "quote": "hero__carousel__0deg"
    },
    {
      "id": "cit-sec-hero-home",
      "source": "src/pages/Home.jsx:12-12",
      "quote": "<Hero />"
    }
  ],
  "contentMaxWordsTotalNote": "Set BETWEEN the measured real total and the maximum the per-field budgets allow, so the cap can actually reject an over-long instance instead of being unreachable. extraction/verify_all.py check [p] fails if any declared contentMaxWordsTotal becomes vacuous (>= the per-field maximum). Previously 35, which was unreachable.",
  "generatedAssetRoles": [
    "fictional-person-avatar",
    "generated-illustration",
    "user-supplied-asset"
  ],
  "retrievalEligible": true
}
