{
  "id": "chrome.cookie-consent",
  "kind": "section",
  "category": "chrome",
  "source": {
    "id": "dom:Cookies:cookies",
    "tag": "<section className=\"cookies\">",
    "file": "src/components/Cookies.jsx",
    "lines": "4-54"
  },
  "semantic": {
    "id": "chrome.cookie-consent",
    "category": "chrome"
  },
  "purpose": "The vendored Finsweet Cookie Consent banner and preference modal. Rendered unconditionally on EVERY route.",
  "content": {
    "type": "object",
    "additionalProperties": false,
    "properties": {
      "title": {
        "type": "string",
        "maxWords": 3,
        "note": "Measured: 2 words, \"Cookie settings\", on both the banner and the modal."
      },
      "body": {
        "type": "string",
        "maxWords": 32,
        "note": "Measured: 30 words, identical on the banner and the modal, containing one inline privacy-policy link.",
        "bodyCopy": true
      },
      "inlineLinkLabel": {
        "type": "string",
        "maxWords": 3,
        "note": "Measured: 2 words, \"privacy policy\"."
      },
      "bannerActions": {
        "type": "array",
        "minItems": 2,
        "maxItems": 2,
        "items": {
          "type": "object",
          "additionalProperties": false,
          "properties": {
            "label": {
              "type": "string",
              "maxWords": 3
            },
            "style": {
              "type": "string",
              "enum": [
                "primary",
                "outline"
              ]
            },
            "fsCc": {
              "type": "string",
              "enum": [
                "allow",
                "open-preferences",
                "submit",
                "close"
              ]
            },
            "href": {
              "type": "string",
              "format": "route-or-inert-hash"
            }
          },
          "required": [
            "label",
            "style",
            "fsCc",
            "href"
          ]
        },
        "note": "Exactly 2: \"Accept all\" (primary, fs-cc=allow) and \"Settings\" (outline, fs-cc=open-preferences)."
      },
      "modalActions": {
        "type": "array",
        "minItems": 2,
        "maxItems": 2,
        "items": {
          "type": "object",
          "additionalProperties": false,
          "properties": {
            "label": {
              "type": "string",
              "maxWords": 3
            },
            "style": {
              "type": "string",
              "enum": [
                "primary",
                "outline"
              ]
            },
            "fsCc": {
              "type": "string",
              "enum": [
                "allow",
                "open-preferences",
                "submit",
                "close"
              ]
            },
            "href": {
              "type": "string",
              "format": "route-or-inert-hash"
            }
          },
          "required": [
            "label",
            "style",
            "fsCc",
            "href"
          ]
        },
        "note": "Exactly 2: \"Accept all\" (primary, fs-cc=allow) and \"Save changes\" (outline, fs-cc=submit)."
      },
      "categories": {
        "type": "array",
        "minItems": 4,
        "maxItems": 4,
        "items": {
          "type": "object",
          "additionalProperties": false,
          "properties": {
            "label": {
              "type": "string",
              "maxWords": 5
            },
            "description": {
              "type": "string",
              "maxWords": 22,
              "bodyCopy": true
            },
            "interactive": {
              "type": "boolean"
            },
            "fsCcCheckbox": {
              "type": "string",
              "enum": [
                "marketing",
                "personalization",
                "analytics",
                "necessary"
              ]
            },
            "assetRole": {
              "type": "string",
              "enum": [
                "form-control-checkmark"
              ]
            }
          },
          "required": [
            "label",
            "description",
            "interactive",
            "fsCcCheckbox"
          ]
        },
        "note": "Exactly 4. Measured labels 1-4 words, descriptions 7-21 words. Only the first is non-interactive (\"Strictly necessary (always active)\")."
      },
      "closeLabel": {
        "type": "string",
        "maxWords": 5,
        "note": "Measured: \"Close cookies modal\" (3) on the banner, \"Close Cookie Preference Manager\" (4) in the modal; both are screen-reader-only."
      }
    },
    "required": [
      "title",
      "body",
      "bannerActions",
      "modalActions",
      "categories"
    ]
  },
  "contentMaxWordsTotal": 140,
  "usedOn": [
    "/",
    "/privacy-policy",
    "/terms-of-service",
    "/start",
    "/auth",
    "/404"
  ],
  "evidence": {
    "structure": "Structure, layout and motion measured against the live original. A pixel audit verified 1382/1382 elements at a 1440px viewport and 962/962 at 390px with zero deltas. Copy is the original's own.",
    "copy": "a-exact",
    "note": "This is VENDORED third-party component copy, not fourmula.ai marketing copy. It is generic Finsweet boilerplate."
  },
  "bodyCopyFields": [
    "body",
    "categories[].description"
  ],
  "variants": {},
  "constraints": {
    "onePerPage": true,
    "maxPerPage": 1,
    "verification": "src/layout/Layout.jsx:39 renders <Cookies /> unconditionally, with no flag. Checked against all 5 real templates: present exactly once in every one, always immediately after the preloader slot."
  },
  "media": {
    "checkmark": {
      "assetRole": [
        "form-control-checkmark"
      ],
      "policy": "must-reuse-exact",
      "generatedAssetRoles": [
        "form-control-checkmark"
      ]
    }
  },
  "motion": {
    "pattern": "overlay-fade",
    "detail": "The head <style> block hides every [fs-cc] region; the banner then ships an inline display:flex and the preferences panel display:none. public/motion/m30.js reveals .cookies over 0.8s power2.out.",
    "reducedMotionFallback": "Show the banner at its final position immediately, with no fade and no translate.",
    "reducedMotionFallbackKind": "design-rule (the source ships NO prefers-reduced-motion handling for this section, so the fallback is prescribed by this repository, not mirrored)"
  },
  "responsive": {
    "structured": true,
    "breakpoint": "none",
    "base": "fixed banner at z-index 9500, modal at 9999 over a scrim",
    "max-991px": "no documented change",
    "max-767px": "no documented change"
  },
  "tokens": [
    "component.cookie-modal.accent",
    "component.cookie-modal.accent-soft",
    "component.cookie-modal.tray-fill",
    "component.cookie-modal.hairline",
    "label.emphasis",
    "label.secondary",
    "label.primary",
    "elevation.z-cookie-banner",
    "elevation.z-preloader",
    "motion.cookies.reveal",
    "radius.control"
  ],
  "composes": [
    "component.cookie-modal",
    "primitive.button-primary",
    "primitive.button-outline",
    "primitive.checkbox",
    "primitive.inline-icon",
    "primitive.text-link"
  ],
  "measuredFrom": [
    {
      "id": "cit-sec-cookies-root",
      "source": "src/components/Cookies.jsx:4-5",
      "quote": "<section className=\"cookies\">"
    },
    {
      "id": "cit-sec-cookies-title",
      "source": "src/components/Cookies.jsx:12-13",
      "quote": "Cookie settings"
    },
    {
      "id": "cit-sec-cookies-body",
      "source": "src/components/Cookies.jsx:13-13",
      "quote": "By clicking \"Accept all cookies\""
    },
    {
      "id": "cit-sec-cookies-cats",
      "source": "src/components/Cookies.jsx:31-46",
      "quote": "fs-cc_checkbox"
    },
    {
      "id": "cit-sec-cookies-layout",
      "source": "src/layout/Layout.jsx:39-39",
      "quote": "<Cookies />"
    }
  ],
  "notes": "The embedded <form id=\"ck-form\" method=\"get\"> carries a data-turnstile-sitekey attribute but neither the Finsweet runtime nor the Cloudflare Turnstile script is loaded, so the whole panel is inert in this clone.",
  "contentMaxWordsTotalNote": "Set BETWEEN the measured real total and the maximum the per-field budgets allow, so the cap can actually reject an over-long instance instead of being unreachable. extraction/verify_all.py check [p] fails if any declared contentMaxWordsTotal becomes vacuous (>= the per-field maximum). Previously 170, which was unreachable.",
  "generatedAssetRoles": [
    "form-control-checkmark"
  ],
  "retrievalEligible": false,
  "retrievalReason": "Runtime consent UI: a fixed cookie banner plus a preferences modal driven by the Finsweet consent script. It is page furniture that appears on every route, not page content, so it is never retrieved as a section example."
}
