{
  "id": "chrome.menu",
  "kind": "section",
  "category": "chrome",
  "source": {
    "id": "dom:Menu:menu",
    "tag": "<section className=\"menu\">",
    "file": "src/components/Menu.jsx",
    "lines": "6-45"
  },
  "semantic": {
    "id": "chrome.menu",
    "category": "chrome"
  },
  "purpose": "The slide-out navigation panel. Present on 4 of the 6 routes; the 404 does not render it.",
  "content": {
    "type": "object",
    "additionalProperties": false,
    "properties": {
      "groups": {
        "type": "array",
        "minItems": 3,
        "maxItems": 3,
        "items": {
          "type": "object",
          "additionalProperties": false,
          "properties": {
            "label": {
              "type": "string",
              "maxWords": 3,
              "note": "Measured: \"Menu\" (1), \"Other\" (1), \"Social media\" (2)."
            },
            "layout": {
              "type": "string",
              "enum": [
                "column",
                "row"
              ]
            },
            "emphasis": {
              "type": "string",
              "enum": [
                "primary",
                "secondary"
              ]
            },
            "links": {
              "type": "array",
              "minItems": 3,
              "maxItems": 4,
              "items": {
                "type": "object",
                "additionalProperties": false,
                "properties": {
                  "label": {
                    "type": "string",
                    "maxWords": 4
                  },
                  "href": {
                    "type": "string",
                    "format": "route-or-inert-hash"
                  },
                  "hidden": {
                    "type": "boolean",
                    "note": "true reproduces the source's .is-hide class: the link is in the markup but invisible."
                  }
                },
                "required": [
                  "label",
                  "href"
                ]
              }
            }
          },
          "required": [
            "label",
            "layout",
            "emphasis",
            "links"
          ]
        },
        "note": "Exactly 3 labelled groups: Menu (4 in-page anchors, label.emphasis), Other (3 policy links, label.secondary), Social media (3 links in a row, 2 of them .is-hide)."
      },
      "cta": {
        "type": "object",
        "additionalProperties": false,
        "properties": {
          "label": {
            "type": "string",
            "maxWords": 3,
            "note": "Measured: the source ships the typo \"Ge tstarted\" (Menu.jsx:41) where every other instance says \"Get started\". Preserved verbatim; do not reproduce the typo in NEW copy."
          },
          "href": {
            "type": "string",
            "format": "route-or-inert-hash"
          },
          "hoverStagger": {
            "type": "boolean"
          }
        },
        "required": [
          "label",
          "href"
        ]
      },
      "signin": {
        "type": "object",
        "additionalProperties": false,
        "properties": {
          "assetRole": {
            "type": "string",
            "enum": [
              "ui-icon-glyph"
            ]
          },
          "accessibleLabel": {
            "type": "string",
            "maxWords": 4
          },
          "href": {
            "type": "string",
            "format": "route-or-inert-hash"
          }
        },
        "required": [
          "assetRole",
          "href"
        ]
      }
    },
    "required": [
      "groups",
      "cta",
      "signin"
    ]
  },
  "contentMaxWordsTotal": 45,
  "usedOn": [
    "/",
    "/privacy-policy",
    "/terms-of-service",
    "/start",
    "/auth"
  ],
  "evidence": {
    "structure": "Structure, layout and motion measured against the live original. A pixel audit verified 1382/1382 elements at a 1440px viewport and 962/962 at 390px with zero deltas. Copy is the original's own.",
    "copy": "a-exact"
  },
  "bodyCopyFields": [],
  "variants": {},
  "constraints": {
    "onePerPage": true,
    "maxPerPage": 1,
    "mustFollowHeader": true,
    "verification": "src/layout/Layout.jsx:42 renders it behind a `menu` flag that defaults to true; src/pages/NotFound.jsx:7 passes menu={false}. Checked against all 5 real templates: present once and immediately after chrome.header in home / legal / app-onboarding / app-auth, and ABSENT from not-found."
  },
  "media": {
    "glyph": {
      "assetRole": [
        "ui-icon-glyph"
      ],
      "policy": "may-generate-new",
      "generatedAssetRoles": [
        "ui-icon-glyph"
      ]
    }
  },
  "motion": {
    "pattern": "panel-expand",
    "detail": "public/motion/m19.js opens the panel over 0.4s power2.out and staggers the list items by 0.05 over 0.3s. Closed geometry 15rem x 2.7rem with translateY(2rem); open 18rem x 39rem. m19.js also carries its own hand-rolled scrambleText().",
    "reducedMotionFallback": "Toggle the panel between its closed and open geometry instantly, with every link at full opacity and no stagger.",
    "reducedMotionFallbackKind": "design-rule (the source ships NO prefers-reduced-motion handling for this section, so the fallback is prescribed by this repository, not mirrored)"
  },
  "responsive": {
    "structured": true,
    "breakpoint": "991px / 767px",
    "base": "closed 15rem x 2.7rem, opens to 18rem x 39rem",
    "max-991px": "open width 16.2rem (m19.js)",
    "max-767px": "closed 15.5rem wide with translateY 0.5rem instead of 1.25rem (m19.js)"
  },
  "tokens": [
    "surface.menu",
    "accent.menu",
    "label.emphasis",
    "label.secondary",
    "caption.small",
    "text.primary",
    "elevation.z-menu",
    "motion.menu.open",
    "motion.hover-stagger.step",
    "layout.menu.panel-closed",
    "radius.panel"
  ],
  "composes": [
    "primitive.text-link",
    "primitive.button-primary",
    "primitive.inline-icon"
  ],
  "measuredFrom": [
    {
      "id": "cit-sec-menu-root",
      "source": "src/components/Menu.jsx:6-6",
      "quote": "<section className=\"menu\">"
    },
    {
      "id": "cit-sec-menu-groups",
      "source": "src/components/Menu.jsx:9-37",
      "quote": "menu__label u-small-text-1 u-fonts-50"
    },
    {
      "id": "cit-sec-menu-hidden",
      "source": "src/components/Menu.jsx:34-36",
      "quote": "u-fonts-100 is-hide"
    },
    {
      "id": "cit-sec-menu-typo",
      "source": "src/components/Menu.jsx:41-41",
      "quote": "Ge tstarted"
    },
    {
      "id": "cit-sec-menu-closed",
      "source": "src/styles/fourmula-head.css:102-107",
      "quote": ".menu__wrap {"
    },
    {
      "id": "cit-sec-menu-flag",
      "source": "src/layout/Layout.jsx:42-42",
      "quote": "{menu && <Menu current={current} />}"
    },
    {
      "id": "cit-sec-menu-404",
      "source": "src/pages/NotFound.jsx:7-7",
      "quote": "menu={false}"
    }
  ],
  "notes": "The menu's Social media group lists Instagram / Linkedin / Youtube while chrome.footer's equivalent group lists Instagram / Facebook / Youtube. The two lists genuinely disagree in the source. Both second and third entries carry .is-hide in both places, so neither is visible; the discrepancy is recorded, not reconciled.",
  "contentMaxWordsTotalNote": "Set BETWEEN the measured real total and the maximum the per-field budgets allow, so the cap can actually reject an over-long instance instead of being unreachable. extraction/verify_all.py check [p] fails if any declared contentMaxWordsTotal becomes vacuous (>= the per-field maximum).",
  "generatedAssetRoles": [
    "ui-icon-glyph"
  ],
  "retrievalEligible": false,
  "retrievalReason": "Runtime drawer: the fixed burger-menu panel that expands over the page on demand. It is navigation chrome shown only on interaction, not a content section, so it is excluded from retrieval."
}
