{
  "id": "hero.not-found",
  "kind": "section",
  "category": "hero",
  "source": {
    "id": "dom:NotFoundContent:hero",
    "tag": "<section id=\"hero\" className=\"hero__404__wrap\">",
    "file": "src/pages/NotFoundContent.jsx",
    "lines": "4-14"
  },
  "semantic": {
    "id": "hero.not-found",
    "category": "hero"
  },
  "purpose": "The 404 page's only content section: a two-tone h1, one outline CTA and a looping theme-paired artwork.",
  "content": {
    "type": "object",
    "additionalProperties": false,
    "properties": {
      "heading": {
        "type": "string",
        "maxWords": 3,
        "note": "Measured: 2 words, \"Our fourmula\"."
      },
      "headingAccent": {
        "type": "string",
        "maxWords": 3,
        "note": "Measured: 2 words, \"is broken\", in a .u-fonts-50 span inside the same h1."
      },
      "cta": {
        "type": "object",
        "additionalProperties": false,
        "properties": {
          "label": {
            "type": "string",
            "maxWords": 3,
            "note": "Measured: 2 words, \"Get started\"."
          },
          "href": {
            "type": "string",
            "format": "route-or-inert-hash"
          },
          "hoverStagger": {
            "type": "boolean"
          }
        },
        "required": [
          "label",
          "href"
        ]
      },
      "artwork": {
        "type": "object",
        "additionalProperties": false,
        "properties": {
          "assetRole": {
            "type": "string",
            "enum": [
              "not-found-artwork",
              "generated-illustration",
              "user-supplied-asset"
            ]
          },
          "assetRef": {
            "type": "string",
            "format": "local-asset-path"
          },
          "alt": {
            "type": "string",
            "maxWords": 28,
            "note": "Required on every content image. Measured 3-27 words across the real images (longest: a 27-word hero carousel description); the four decorative preloader images ship alt=\"\", which is why the empty string is allowed. alt is accessibility text, not visible page copy, so it carries its own budget but is excluded from contentMaxWordsTotal.",
            "allowEmpty": true,
            "countsTowardTotal": false
          },
          "themePairRef": {
            "type": "string",
            "format": "local-asset-path"
          }
        },
        "required": [
          "assetRole"
        ],
        "note": "A theme pair: the .theme-dark member ships visible and the .theme-light member hidden, even though the page renders LIGHT."
      }
    },
    "required": [
      "heading",
      "headingAccent",
      "cta",
      "artwork"
    ]
  },
  "contentMaxWordsTotal": 8,
  "usedOn": [
    "/404"
  ],
  "evidence": {
    "structure": "Structure and copy measured from the live original's own 404 page.",
    "copy": "a-exact"
  },
  "bodyCopyFields": [],
  "variants": {},
  "constraints": {
    "onePerPage": true,
    "maxPerPage": 1,
    "mustBeFirstInBody": true,
    "notFoundRouteOnly": true,
    "verification": "src/pages/NotFound.jsx:8 renders <NotFoundContent /> as the only child of <Layout>. Checked against all 5 real templates: it appears only in `not-found`, where - because that template has no chrome.menu - it is the node immediately after chrome.header."
  },
  "media": {
    "artwork": {
      "assetRole": [
        "not-found-artwork"
      ],
      "policy": "must-not-fabricate",
      "count": 2,
      "note": "The only two .webp files in the whole project.",
      "generatedAssetRoles": [
        "generated-illustration",
        "user-supplied-asset"
      ]
    }
  },
  "motion": {
    "pattern": "hero-reveal",
    "detail": "The h1 carries data-hero-text, so public/motion/m25.js reveals it with the 0.2 stagger and the data-final-opacity rule. The artwork loops inside .hero__404__loop. public/motion/m11.js owns the theme pair swap.",
    "reducedMotionFallback": "Show the h1 and the CTA at final opacity with no stagger, and hold the artwork on its first frame.",
    "reducedMotionFallbackKind": "design-rule (the source ships NO prefers-reduced-motion handling for this section, so the fallback is prescribed by this repository, not mirrored)"
  },
  "responsive": {
    "structured": true,
    "breakpoint": "991px / 767px",
    "base": "heading.page 5.5rem; the loop layers are 103rem wide",
    "max-991px": "heading.page drops to 4.5rem",
    "max-767px": "heading.page drops to 2.5rem"
  },
  "tokens": [
    "heading.page",
    "text.primary",
    "text.muted",
    "component.button.outline.border",
    "component.button.outline.text",
    "radius.control",
    "motion.hover-stagger.step",
    "label.button"
  ],
  "composes": [
    "primitive.button-outline",
    "component.media-image"
  ],
  "measuredFrom": [
    {
      "id": "cit-sec-404-root",
      "source": "src/pages/NotFoundContent.jsx:4-4",
      "quote": "<section id=\"hero\" className=\"hero__404__wrap\">"
    },
    {
      "id": "cit-sec-404-h1",
      "source": "src/pages/NotFoundContent.jsx:6-7",
      "quote": "hero__404__txt u-h1 u-fonts-100"
    },
    {
      "id": "cit-sec-404-cta",
      "source": "src/pages/NotFoundContent.jsx:8-9",
      "quote": "btn-outline u-btn is-header-btn w-inline-block"
    },
    {
      "id": "cit-sec-404-art",
      "source": "src/pages/NotFoundContent.jsx:13-14",
      "quote": "hero__404__loop-img theme-dark"
    },
    {
      "id": "cit-sec-404-page",
      "source": "src/pages/NotFound.jsx:7-8",
      "quote": "<Layout current=\"/404\" preloader menu={false} footer={false}>"
    },
    {
      "id": "cit-sec-404-route",
      "source": "src/App.jsx:21-21",
      "quote": "<Route path=\"*\" element={<NotFound />} />"
    }
  ],
  "notes": "The section reuses id=\"hero\" (the same DOM id the home hero uses) but a different class, hero__404__wrap. The two never co-occur, because no template contains both hero.home and hero.not-found, so the duplicate id is not a conflict in practice.",
  "contentMaxWordsTotalNote": "Set BETWEEN the measured real total and the maximum the per-field budgets allow, so the cap can actually reject an over-long instance instead of being unreachable. extraction/verify_all.py check [p] fails if any declared contentMaxWordsTotal becomes vacuous (>= the per-field maximum). Previously 35, which was unreachable.",
  "generatedAssetRoles": [
    "generated-illustration",
    "user-supplied-asset"
  ],
  "retrievalEligible": true
}
