{
  "id": "faq.accordion",
  "kind": "section",
  "category": "faq",
  "source": {
    "id": "dom:Faq:faq",
    "tag": "<section className=\"faq\">",
    "file": "src/components/Faq.jsx",
    "lines": "4-51"
  },
  "semantic": {
    "id": "faq.accordion",
    "category": "faq"
  },
  "purpose": "The six-item FAQ accordion, the last body section on the home page.",
  "content": {
    "type": "object",
    "additionalProperties": false,
    "properties": {
      "eyebrow": {
        "type": "string",
        "maxWords": 2,
        "note": "Measured: 1 word, \"FAQs\"."
      },
      "headingLines": {
        "type": "array",
        "minItems": 2,
        "maxItems": 2,
        "items": {
          "type": "string",
          "maxWords": 4
        },
        "note": "Exactly 2 lines separated by a <br/>. Measured: \"Not AI-gen answers.\" (3) and \"Real ones here.\" (3)."
      },
      "items": {
        "type": "array",
        "minItems": 6,
        "maxItems": 6,
        "items": {
          "type": "object",
          "additionalProperties": false,
          "properties": {
            "question": {
              "type": "string",
              "maxWords": 9,
              "note": "Measured 6-8 words across all six items."
            },
            "answer": {
              "type": "string",
              "maxWords": 18,
              "note": "Measured 11-17 words across all six items; each is a single <p>.",
              "bodyCopy": true
            },
            "icon": {
              "type": "string",
              "enum": [
                "+"
              ],
              "note": "A literal plus character, not a glyph. public/motion/m13.js toggles the item's `active` class, which is what changes it."
            }
          },
          "required": [
            "question",
            "answer"
          ]
        },
        "note": "Exactly 6 items. All ship collapsed (display:none, height:0px inline), so none is open by default."
      }
    },
    "required": [
      "eyebrow",
      "headingLines",
      "items"
    ]
  },
  "contentMaxWordsTotal": 155,
  "usedOn": [
    "/"
  ],
  "evidence": {
    "structure": "Structure, layout and motion measured against the live original. A pixel audit verified 1382/1382 elements at a 1440px viewport and 962/962 at 390px with zero deltas. Copy is the original's own.",
    "copy": "a-exact"
  },
  "bodyCopyFields": [
    "items[].answer"
  ],
  "variants": {},
  "constraints": {
    "onePerPage": true,
    "maxPerPage": 1,
    "homeRouteOnly": true,
    "mustBeLastInBody": true,
    "verification": "src/pages/Home.jsx:17 renders <Faq /> last inside <Layout>. Checked against all 5 real templates: it appears only in `home`, as the last body node before chrome.footer."
  },
  "media": {},
  "motion": {
    "pattern": "flash-word-reveal",
    "detail": "The h2 carries data-flash and runs the m22 + m23 split-and-reveal sequence. public/motion/m13.js drives the accordion: it binds click on .faq__item-title, toggles `active` on the item and animates .faq__content height.",
    "reducedMotionFallback": "Render the heading unsplit at text.primary and open or close each item instantly, with no height animation. Keep every item closed on load, as the source does.",
    "reducedMotionFallbackKind": "design-rule (the source ships NO prefers-reduced-motion handling for this section, so the fallback is prescribed by this repository, not mirrored)"
  },
  "responsive": {
    "structured": true,
    "breakpoint": "991px / 767px",
    "base": "eyebrow left, heading and accordion right; question at body.large 1.25rem, answer at body.default 1rem",
    "max-991px": "heading.display drops 7.5rem -> 5.5rem; both body steps unchanged",
    "max-767px": "heading.display 2.25rem, label.tag 1rem, body.large 1rem and body.default 0.875rem - question and answer nearly converge"
  },
  "tokens": [
    "label.tag",
    "heading.display",
    "body.large",
    "body.default",
    "text.primary",
    "border.hairline",
    "motion.transition.fast",
    "motion.flash.reveal-in",
    "motion.flash.step",
    "motion.flash.settle"
  ],
  "composes": [
    "primitive.eyebrow-tag",
    "component.faq-item"
  ],
  "measuredFrom": [
    {
      "id": "cit-sec-faq-root",
      "source": "src/components/Faq.jsx:4-4",
      "quote": "<section className=\"faq\">"
    },
    {
      "id": "cit-sec-faq-eyebrow",
      "source": "src/components/Faq.jsx:6-6",
      "quote": "faq__txt u-tag u-fonts-100"
    },
    {
      "id": "cit-sec-faq-h2",
      "source": "src/components/Faq.jsx:9-12",
      "quote": "faq__title-in u-h2 u-fonts-100"
    },
    {
      "id": "cit-sec-faq-item1",
      "source": "src/components/Faq.jsx:16-21",
      "quote": "What can AI FOURMULA create for my brand?"
    },
    {
      "id": "cit-sec-faq-item6",
      "source": "src/components/Faq.jsx:46-51",
      "quote": "Does this replace my creative team?"
    },
    {
      "id": "cit-sec-faq-home",
      "source": "src/pages/Home.jsx:17-17",
      "quote": "<Faq />"
    }
  ],
  "contentMaxWordsTotalNote": "Set BETWEEN the measured real total and the maximum the per-field budgets allow, so the cap can actually reject an over-long instance instead of being unreachable. extraction/verify_all.py check [p] fails if any declared contentMaxWordsTotal becomes vacuous (>= the per-field maximum). Previously 170, which was unreachable.",
  "generatedAssetRoles": [],
  "retrievalEligible": true
}
